id,product_name,description
7,Zoha,Zoha is a brand that sells women's clothing at various price points. They offer a wide variety of styles from casual wear to formal attire . You can find everything from winter wear to summer collections featuring materials like lawn khaddar and jacquard . Zoha can also refer to a specific type of outfit particularly in South Asian fashion. It typically consists of three pieces: a kameez (a long tunic) trousers and a dupatta (a scarf) . The materials and embellishments can vary de
8,Falak,Fashion trends and styles often emerge organically influenced by cultural preferences designers' visions and practical considerations like weather and occasion.  They might be inspired by historical styles or art movements but there's no single theory dictating their design. Falak attire appears to come in various styles from dressy options with luxurious embroidery to lighter sets designed for casual wear or warm days
9,Dastaan,Fashion trends and styles generally emerge from a combination of factors not a single theory. These influences can include:Cultural preferences: Social norms religious beliefs and local aesthetics can play a role in what people find fashionable.Designers' visions: Creative designers can spark trends with their unique ideas and interpretations. Practical considerations: Climate occasion and comfort all influence what people choose to wear.
10,Raw Silk Eid Collection,A Raw Silk Eid Collection typically embodies the essence of traditional elegance blended with contemporary design elements catering to the festive spirit of Eid celebrations.As the joyous occasion of Eid approaches immerse yourself in the opulent world of Raw Silk with our exclusive Eid Collection. Crafted with meticulous attention to detail and infused with the richness of tradition each ensemble in this collection is a masterpiece designed to elevate your festive look to new heights
11,RangReza,Drawing inspiration from the rich tapestry of cultural heritage RangReza Attire presents a collection that honors traditional craftsmanship while embracing contemporary sensibilities. Each piece is meticulously crafted with a modern twist offering a seamless blend of timeless charm and contemporary flair.At the heart of RangReza Attire lies a kaleidoscope of colors that captures the essence of joy and vitality. From vivid shades of magenta and turquoise to earthy tones of ochre and rust
12,Ayleen,Step into sophistication with Ayleen Attire where classic elegance meets contemporary allure. Our collection embodies timeless beauty with a modern edge offering versatile pieces that elevate your style effortlessly.Discover the essence of chic simplicity and effortless glamour with Ayleen Attire. From sleek silhouettes to refined detailing each piece exudes understated sophistication allowing you to make a statement without saying a word.
13,Minahl,Step into sophistication with Ayleen Attire where classic elegance meets contemporary allure. Our collection embodies timeless beauty with a modern edge offering versatile pieces that elevate your style effortlessly.Discover the essence of chic simplicity and effortless glamour with Ayleen Attire. From sleek silhouettes to refined detailing each piece exudes understated sophistication allowing you to make a statement without saying a word.
14,Golden Tara Figures – Antique Statue,Crafted from the finest materials and adorned with exquisite details our Golden Tara Figures shimmer with an otherworldly radiance that captivates the imagination. Each statue stands as a timeless symbol of beauty grace and spiritual significance embodying the divine feminine in all her glory.From the delicate features of the face to the intricate patterns adorning the attire every aspect of our Golden Tara Figures is meticulously crafted with unparalleled precision and care. Each stroke of
15,Wood screw,In the realm of woodworkin the humble wood screw stands as a cornerstone of construction a small yet mighty component that holds together the fabric of our creations with unwavering strength and precision.Crafted from hardened steel or durable brass the wood screw is engineered to provide unyielding strength and a reliable hold ensuring that every joint and connection remains steadfast under pressure. With its sharp threads and tapered body the wood screw bites into the wood fibers.
16,Spoon,In the gastronomic symphony of culinary creationthe spoon emerges as a fundamental instrument harmonizing comfort and precision in its elegant design.At its essence the spoon embodies utility and versatility transcending the confines of mere tableware to become an indispensable tool in the hands of chefs and cooks alike. From stirring and folding to portioning and tasting its adaptability knows no bounds seamlessly integrating into every stage of the culinary journey.
17,Natraj Statue,In the vast tapestry of Hindu mythology the Nataraj statue stands as a profound symbol of the eternal dance of creation and destruction embodying the cosmic forces that shape the universe.Depicted in the iconic pose of the Nataraj Lord Shiva the supreme deity of transformation is portrayed as the cosmic dancer his dynamic movements encapsulating the eternal rhythm of existence. With one foot gracefully raised he performs the divine dance of Tandava symbolizing the cycle of creation pres
18,Golden Buddha Stupa,Nestled amidst serene landscapes and tranquil sanctuaries the Golden Buddha Stupa rises as a beacon of spiritual enlightenment and a testament to the timeless wisdom of the Buddha.The Golden Buddha Stupa stands as a monumental tribute to the teachings of Siddhartha Gautama the enlightened one whose profound insights into the nature of existence continue to inspire seekers of truth and wisdom across the globe. Crafted with meticulous attention to detail and adorned with shimmering gold the st
19,Chopping board,In the bustling kitchen amidst the symphony of sizzling pans and fragrant spices the chopping board stands as a steadfast companion providing the essential canvas upon which culinary creations are born.Crafted from sturdy wood durable plastic or sleek bamboo the chopping board offers a solid surface that serves as the foundation for culinary creativity. Its flat level plane provides stability and support allowing chefs and home cooks alike to wield their knives with precision and confide
20,Tradational camera,In the annals of photographic history the traditional camera stands as a timeless emblem of creativity and nostalgia offering a tangible gateway to the past and a cherished tool for capturing the fleeting beauty of the present.Crafted with precision engineering and intricate mechanical mechanisms traditional cameras are marvels of human ingenuity blending artistry with technology to capture light and transform it into lasting images. From the elegant simplicity of vintage film cameras to the
21,Wooden Ganesh Statue,In the sacred realm of Hindu spirituality the Wooden Ganesh Statue emerges as a revered icon embodying the essence of wisdom prosperity and divine protection. Crafted with reverence and precision each statue serves as a tangible manifestation of the beloved deity Lord Ganesh whose benevolent presence is believed to bring blessings and remove obstacles from the paths of devoteesCarved from the finest quality wood the Wooden Ganesh Statue bears the marks of skilled craftsmanship and devoti
22,Artistic Wooden Door,In the architectural landscape the Artistic Wooden Door emerges as more than just a functional entryway; it is a masterpiece of design and craftsmanship that serves as the focal point of a home's exterior inviting admiration and evoking a sense of grandeur and elegance.Each Artistic Wooden Door is a testament to the artisan's skill and the inherent beauty of wood as a medium. Carefully selected hardwoods such as oak mahogany or teak are meticulously carved and shaped to create intricate patt
23,Beauty Mask,In the realm of skincare the beauty mask emerges as a cherished ritual offering a luxurious and rejuvenating experience that nourishes the skin revitalizes the senses and unveils a radiant complexion brimming with youthful vitality.Crafted from a harmonious blend of botanical extracts vitamins and skin-loving nutrients the beauty mask is meticulously formulated to address a myriad of skincare concerns from hydration and brightening to firming and clarifying. Each ingredient is carefully
24,Spoon bundle,The Spoon Bundle presents a curated collection of culinary essentials designed to elevate your cooking experience and streamline your kitchen tasks with style and efficiency. This thoughtfully assembled bundle includes an array of spoons each serving a unique purpose in the culinary journey ensuring that you have the right tool for every culinary task at hand.From stirring and mixing to serving and tasting the Spoon Bundle offers versatility in design and functionality in action. Included in
25,Glass birds,Crafted with delicate precision and inspired artistry glass birds emerge as captivating treasures that grace the home with their ethereal beauty and timeless charm. Each glass bird is a testament to the skill of the artisan capturing the essence of avian grace and imbuing it with a sense of wonder and enchantment.From vibrant songbirds to majestic birds of prey glass artisans meticulously recreate the intricate details of avian anatomy from delicate feathers to expressive beaks and lifelike
26,Wooden basket,In the world of home décor and organization the wooden basket stands as a timeless symbol of rustic elegance and natural versatility. Crafted from sturdy wood materials such as bamboo rattan or reclaimed timber the wooden basket seamlessly combines functionality with aesthetic appeal offering a myriad of uses in any living space.Each wooden basket is a testament to the artistry of skilled craftsmen who meticulously weave shape or carve the wood into intricate patterns and designs. Whethe
27,Wine glass,In the world of oenology and sophisticated dining the wine glass reigns supreme as the vessel of choice for savoring the nuances of fine wines. Its delicate stem graceful bowl and tapered rim come together in harmonious union elevating the drinking experience with a touch of elegance and refinement.The wine glass is characterized by its elegant stem which not only adds to its visual appeal but also serves a functional purpose. By lifting the bowl away from the hand the stem prevents the tr
29,Celebration,Celebration is more than just an event; it's a spirited embrace of joy a collective acknowledgment of milestones achievements or simply the beauty of life itself. Whether marking a significant occasion or reveling in the everyday moments that make life extraordinary celebration is a universal expression of gratitude camaraderie and hope.
30,Chairs,In the world of furniture design chairs stand as quintessential pieces that blend functionality with aesthetic appeal providing seating solutions that cater to comfort style and versatility. From classic designs to contemporary innovations chairs come in a myriad of forms materials and styles to suit every space and taste.At the core of chair design lies the principle of ergonomic comfort with thoughtful consideration given to the human form and its need for support and relaxation. Chair
31,Headphone,In the realm of personal audio headphones stand as indispensable companions offering a gateway to immersive soundscapes crystal-clear communication and uninterrupted musical journeys. These sleek wearable devices come in a variety of styles and technologies catering to diverse needs and preferences while delivering unparalleled audio performance.
32,Vintage Ridgway Heritage,Vintage Ridgway Heritage represents a legacy of craftsmanship and elegance in the realm of fine china. Revered for its timeless designs exquisite detailing and enduring quality Ridgway Heritage pieces evoke a sense of nostalgia while maintaining their relevance and allure in modern dining settings.With roots tracing back to the renowned Ridgway Potteries founded in Staffordshire England Vintage Ridgway Heritage carries forward a legacy of excellence in ceramic artistry. Each piece is a test

